{
  "slug": "settings-prompt",
  "title": "Settings Prompt Input Redesign",
  "selectedOption": {
    "id": "B+A+C",
    "summary": "以方案 B 的操作型工作台为基础，合并方案 A 的安静顶部导航和方案 C 的显性错误状态处理。",
    "mergedFrom": ["A", "B", "C"],
    "decisionNotes": "用户选择 B 的效率结构、A 的低干扰周边节奏，以及 C 的清晰错误恢复。"
  },
  "sourceArtifacts": {
    "workbench": "fixtures/docs-design-sample/settings-prompt/workbench.html",
    "options": {
      "A": "fixtures/docs-design-sample/settings-prompt/option-a.html",
      "B": "fixtures/docs-design-sample/settings-prompt/option-b.html",
      "C": "fixtures/docs-design-sample/settings-prompt/option-c.html"
    },
    "productContext": "PRODUCT.md",
    "designContext": "DESIGN.md",
    "directionsEvidence": "fixtures/docs-design-sample/settings-prompt/evidence/directions.json",
    "surfaceEvidence": [
      "用户描述 /settings prompt input component",
      "代码推断，用户确认前标注为未视觉验证"
    ]
  },
  "surface": {
    "name": "/settings prompt input component",
    "type": "component",
    "route": "/settings",
    "currentSource": ["user-description", "code-inference"],
    "confidence": "user-confirmed"
  },
  "changeType": "modify",
  "keep": [
    "Existing settings page route and navigation",
    "Existing submit logic and component API",
    "Existing product tokens and icon set",
    "Existing data flow for saved prompt content"
  ],
  "change": [
    "Prompt editor hierarchy",
    "Template and preview proximity",
    "Validation and saved-state feedback",
    "Local density and helper text placement"
  ],
  "avoid": [
    "Do not add permissions, API behavior, or database schema",
    "Do not invent real team prompt data",
    "Do not use placeholder imagery",
    "Do not use rounded cards with colored side borders as emphasis"
  ],
  "screens": [
    {
      "id": "settings-prompt-default",
      "description": "设置页内的默认提示词编辑器",
      "composition": "Quiet topbar, template rail, central editor, right preview/status panel",
      "hierarchy": "Editor title and textarea first, validation preview second, templates third",
      "density": "snug"
    },
    {
      "id": "settings-prompt-error",
      "description": "提示词内容不足时的验证错误状态",
      "composition": "Error message appears near the editor and preview panel without moving the page shell",
      "hierarchy": "Error text is visible but does not override the primary edit action",
      "density": "snug"
    }
  ],
  "states": [
    {
      "name": "default",
      "expectation": "Prompt editor is ready, helper copy states that example content is placeholder if no real data exists.",
      "priority": "P1"
    },
    {
      "name": "error",
      "expectation": "Validation error is explicit, close to the editor, and reachable by screen readers.",
      "priority": "P1"
    },
    {
      "name": "success",
      "expectation": "Saved state confirms scope without inventing downstream workflow.",
      "priority": "P2"
    },
    {
      "name": "long-text",
      "expectation": "Long prompt content can scroll or resize without overflowing controls.",
      "priority": "P2"
    }
  ],
  "interactions": [
    {
      "trigger": "Click Validate",
      "result": "Preview/status panel updates to show validation result.",
      "accessibility": "Status text is adjacent to the editor and should be announced or reachable."
    },
    {
      "trigger": "Keyboard focus enters textarea and actions",
      "result": "Focus-visible outline is clear and does not rely only on color.",
      "accessibility": "Textarea has an accessible label and buttons use action labels."
    }
  ],
  "tokens": {
    "source": "DESIGN.md or existing project tokens",
    "rules": [
      "Map background, surface, ink, muted, accent, border, success, and error to existing tokens.",
      "Do not introduce a new color system for this component.",
      "Use existing icon set if icons are needed."
    ]
  },
  "implementationConstraints": {
    "sourceOptions": ["A", "B", "C"],
    "designSystemRules": [
      "DESIGN.md: colors.primary 只用于 durable actions 和 selected states；保存主动作是唯一映射到该 token 的控件。",
      "DESIGN.md: Components 章节的 cards、inputs、buttons 使用 stable spacing 和 modest radius；预览面板只组合现有规则。",
      "DESIGN.md: Colors / Components / Accessibility 规则要求语义状态、focus-visible、可读对比度和 reduced motion。"
    ],
    "codeReuseHypothesis": [
      "暂无可验证源码复用证据：样例 fixture 不包含目标项目源码；实现前需在目标仓库定位设置面板、输入控件、局部状态反馈、错误说明和操作动作组件。"
    ],
    "allowedChangeBoundary": [
      "只改输入区层级、帮助信息位置和局部保存反馈，不改设置导航和提交逻辑。",
      "允许调整输入、模板、预览和状态的相对位置，不改路由、数据流或权限范围。",
      "允许增强输入区错误说明、恢复动作和保存反馈，不改数据流、导航或新增配置项。"
    ],
    "implementationRisk": "medium",
    "selfReviewChecks": [
      "保存主动作仍是唯一使用 colors.primary 的控件，错误/成功状态不硬编码新颜色。",
      "diff 不触及已确认设置面板的 route、保存数据流和公开组件 API。",
      "小屏折叠后输入控件仍是第一优先且无文字溢出。",
      "error、success、loading 状态均有可访问文本、focus-visible 和 reduced-motion 兜底。"
    ]
  },
  "responsive": [
    {
      "viewport": "desktop",
      "rule": "Three-column console may be used when width supports it; editor remains the main column."
    },
    {
      "viewport": "tablet",
      "rule": "Templates and preview can stack below editor without losing state visibility."
    },
    {
      "viewport": "mobile",
      "rule": "Single-column layout, no text overflow, actions remain reachable without hover."
    }
  ],
  "motion": [
    {
      "name": "state-feedback",
      "rule": "Use low-presence transitions for validation status only.",
      "reducedMotion": "Status changes must remain clear with no animation."
    }
  ],
  "assets": [
    {
      "name": "icons",
      "source": "Existing project icon set",
      "rule": "Use one icon style and size if icons are added; icons are optional in MVP."
    }
  ],
  "acceptanceRules": [
    {
      "id": "AR-001",
      "rule": "Implementation follows selected B+A+C composition and preserves existing route, logic, component API, tokens, and data flow.",
      "severity": "P1"
    },
    {
      "id": "AR-002",
      "rule": "No invented data, lorem copy, fake controls, placeholder imagery, or rounded-card plus colored-left-border emphasis.",
      "severity": "P1"
    },
    {
      "id": "AR-003",
      "rule": "Default, error, success, long-text, keyboard focus, and mobile layouts are tested.",
      "severity": "P2"
    }
  ]
}
